<?xml version="1.0" encoding="UTF-8" standalone="no"?>
<NETWORK xmlns="http://www.uppermodel.org/uam/systems" xmlns:xsi="http://www.w3.org/2001/XMLSchema-instance" xsi:schemaLocation="http://www.uppermodel.org/uam/systems uam.system.xsd">
    <ROOT>
        <FEATURE>
            <NAME>wording</NAME>
            <STATE>active</STATE>
        </FEATURE>
    </ROOT>
    <SYSTEMS>
        <SYSTEM>
            <NAME>RELATIONAL-MODE</NAME>
            <EC>relational</EC>
            <FEATURES>
                <FEATURE>
                    <NAME>attributive</NAME>
                    <STATE>active</STATE>
                    <REALISATIONS>
                        <REALISATION>
                            <OP>Insert</OP>
                            <ARGS>Carrier</ARGS>
                        </REALISATION>
                        <REALISATION>
                            <OP>Insert</OP>
                            <ARGS>Attribute</ARGS>
                        </REALISATION>
                    </REALISATIONS>
                </FEATURE>
                <FEATURE>
                    <NAME>identifying</NAME>
                    <STATE>active</STATE>
                    <REALISATIONS>
                        <REALISATION>
                            <OP>Insert</OP>
                            <ARGS>Token</ARGS>
                        </REALISATION>
                        <REALISATION>
                            <OP>Insert</OP>
                            <ARGS>Value</ARGS>
                        </REALISATION>
                    </REALISATIONS>
                </FEATURE>
            </FEATURES>
        </SYSTEM>
        <SYSTEM>
            <NAME>RELATIONAL</NAME>
            <EC>relational2</EC>
            <FEATURES>
                <FEATURE>
                    <NAME>epithet</NAME>
                    <STATE>active</STATE>
                </FEATURE>
                <FEATURE>
                    <NAME>possessive2</NAME>
                    <STATE>active</STATE>
                </FEATURE>
                <FEATURE>
                    <NAME>incidental2</NAME>
                    <STATE>active</STATE>
                </FEATURE>
            </FEATURES>
        </SYSTEM>
        <SYSTEM>
            <NAME>RELATIONAL-TYPE2</NAME>
            <EC>relational-participant</EC>
            <FEATURES>
                <FEATURE>
                    <NAME>carrier</NAME>
                    <STATE>active</STATE>
                </FEATURE>
                <FEATURE>
                    <NAME>attribute</NAME>
                    <STATE>active</STATE>
                </FEATURE>
            </FEATURES>
        </SYSTEM>
        <SYSTEM>
            <NAME>RELATIONAL-TYPE1</NAME>
            <EC>relational-participant</EC>
            <FEATURES>
                <FEATURE>
                    <NAME>possessor</NAME>
                    <STATE>active</STATE>
                </FEATURE>
                <FEATURE>
                    <NAME>possessed</NAME>
                    <STATE>active</STATE>
                </FEATURE>
                <FEATURE>
                    <NAME>domain</NAME>
                    <STATE>active</STATE>
                </FEATURE>
                <FEATURE>
                    <NAME>range</NAME>
                    <STATE>active</STATE>
                </FEATURE>
                <FEATURE>
                    <NAME>incidence</NAME>
                    <STATE>active</STATE>
                </FEATURE>
                <FEATURE>
                    <NAME>entity</NAME>
                    <STATE>active</STATE>
                </FEATURE>
                <FEATURE>
                    <NAME>property</NAME>
                    <STATE>active</STATE>
                </FEATURE>
            </FEATURES>
        </SYSTEM>
        <SYSTEM>
            <NAME>CLAUSE-TYPE</NAME>
            <EC>clause</EC>
            <FEATURES>
                <FEATURE>
                    <NAME>being-and-having</NAME>
                    <STATE>active</STATE>
                </FEATURE>
                <FEATURE>
                    <NAME>doing-and-happening</NAME>
                    <STATE>active</STATE>
                </FEATURE>
            </FEATURES>
        </SYSTEM>
        <SYSTEM>
            <NAME>EXPERITIAL-DOWNRANKED</NAME>
            <EC>downranked</EC>
            <FEATURES>
                <FEATURE>
                    <NAME>relational2</NAME>
                    <STATE>active</STATE>
                </FEATURE>
                <FEATURE>
                    <NAME>thing</NAME>
                    <STATE>active</STATE>
                </FEATURE>
            </FEATURES>
        </SYSTEM>
        <SYSTEM>
            <NAME>RANK</NAME>
            <EC>wording</EC>
            <FEATURES>
                <FEATURE>
                    <NAME>clause</NAME>
                    <STATE>active</STATE>
                </FEATURE>
                <FEATURE>
                    <NAME>group-phrase</NAME>
                    <STATE>active</STATE>
                </FEATURE>
            </FEATURES>
        </SYSTEM>
        <SYSTEM>
            <NAME>INTERPERSONAL-DOWNRANKED</NAME>
            <EC>downranked</EC>
            <FEATURES>
                <FEATURE>
                    <NAME>head</NAME>
                    <STATE>active</STATE>
                </FEATURE>
                <FEATURE>
                    <NAME>modifier</NAME>
                    <STATE>active</STATE>
                </FEATURE>
            </FEATURES>
        </SYSTEM>
        <SYSTEM>
            <NAME>POSSESSIVE-DIATHESIS</NAME>
            <EC>possessive</EC>
            <FEATURES>
                <FEATURE>
                    <NAME>having-type</NAME>
                    <STATE>active</STATE>
                </FEATURE>
                <FEATURE>
                    <NAME>belonging-type</NAME>
                    <STATE>active</STATE>
                </FEATURE>
            </FEATURES>
        </SYSTEM>
        <SYSTEM>
            <NAME>RELATIONAL-TYPE</NAME>
            <EC>relational</EC>
            <FEATURES>
                <FEATURE>
                    <NAME>intrinsic</NAME>
                    <STATE>active</STATE>
                </FEATURE>
                <FEATURE>
                    <NAME>incidental</NAME>
                    <STATE>active</STATE>
                </FEATURE>
                <FEATURE>
                    <NAME>possessive</NAME>
                    <STATE>active</STATE>
                    <REALISATIONS>
                        <REALISATION>
                            <OP>Insert</OP>
                            <ARGS>Possessor</ARGS>
                        </REALISATION>
                        <REALISATION>
                            <OP>Insert</OP>
                            <ARGS>Possessed</ARGS>
                        </REALISATION>
                    </REALISATIONS>
                </FEATURE>
            </FEATURES>
        </SYSTEM>
        <SYSTEM>
            <NAME>POSSESSIVE-TYPE</NAME>
            <EC>possessive</EC>
            <FEATURES>
                <FEATURE>
                    <NAME>ownership&amp;belonging</NAME>
                    <STATE>active</STATE>
                </FEATURE>
                <FEATURE>
                    <NAME>part&amp;part-of</NAME>
                    <STATE>active</STATE>
                </FEATURE>
            </FEATURES>
        </SYSTEM>
        <SYSTEM>
            <NAME>INCIDENCE-TYPE</NAME>
            <EC>incidence</EC>
            <FEATURES>
                <FEATURE>
                    <NAME>circumstance</NAME>
                    <STATE>active</STATE>
                </FEATURE>
                <FEATURE>
                    <NAME>circumhabence</NAME>
                    <STATE>active</STATE>
                </FEATURE>
            </FEATURES>
        </SYSTEM>
        <SYSTEM>
            <NAME>POSSESSIVE2-TYPE</NAME>
            <EC>possessive2</EC>
            <FEATURES>
                <FEATURE>
                    <NAME>thing-with-parts</NAME>
                    <STATE>active</STATE>
                </FEATURE>
                <FEATURE>
                    <NAME>part-of-thing</NAME>
                    <STATE>active</STATE>
                </FEATURE>
                <FEATURE>
                    <NAME>belonging</NAME>
                    <STATE>active</STATE>
                </FEATURE>
                <FEATURE>
                    <NAME>owner</NAME>
                    <STATE>active</STATE>
                </FEATURE>
            </FEATURES>
        </SYSTEM>
        <SYSTEM>
            <NAME>EXPERIENTIAL-FUNCTION</NAME>
            <EC>group-phrase</EC>
            <FEATURES>
                <FEATURE>
                    <NAME>process</NAME>
                    <STATE>active</STATE>
                </FEATURE>
                <FEATURE>
                    <NAME>relational-participant</NAME>
                    <STATE>active</STATE>
                </FEATURE>
                <FEATURE>
                    <NAME>downranked</NAME>
                    <STATE>active</STATE>
                </FEATURE>
            </FEATURES>
        </SYSTEM>
        <SYSTEM>
            <NAME>BEING-AND-HAVING-TYPE</NAME>
            <EC>being-and-having</EC>
            <FEATURES>
                <FEATURE>
                    <NAME>relational</NAME>
                    <STATE>active</STATE>
                </FEATURE>
                <FEATURE>
                    <NAME>existential</NAME>
                    <STATE>active</STATE>
                </FEATURE>
            </FEATURES>
        </SYSTEM>
        <SYSTEM>
            <NAME>ATTRIBUTIVE-HAVING-TYPE-GATE</NAME>
            <EC>
                <OP>and</OP>
                <FEATURE>
                    <NAME>having-type</NAME>
                    <STATE>active</STATE>
                </FEATURE>
                <FEATURE>
                    <NAME>attributive</NAME>
                    <STATE>active</STATE>
                </FEATURE>
            </EC>
            <FEATURES>